{
  "schema_version": 1,
  "experiment_id": "el506-354-matrix-scaled-precision-native-v1",
  "roadmap_item": "EL506-354",
  "catalog_id": "el506-physical-keys-v1",
  "simulator": {
    "profile_id": "sharp-el506ts-pc-simulator-1.0.2.0",
    "product": "SHARP PC Simulator for EL-506TS",
    "build": "1.0.2.0",
    "runtime_sha256": "6bfef4d04900b472892be2d4c54dcfa6013f87232097e32df508ca4c27425530",
    "locale": "English UI; en-US",
    "operating_system": "Windows 11"
  },
  "capture": {
    "date": "2026-10-08",
    "timezone": "America/Port_of_Spain",
    "method": "Live @oai/sky, exactly one native input then an inspected screenshot per action. Independently transcribed significant LCD checkpoints. Only DEG indicator consistently transcribed; other indicators and hidden stored precision are not claimed by this trace. Intermediate golden frames characterize implementation, not independent parity.",
    "evidence_kind": "live-simulator",
    "source_ids": [
      "live-session"
    ]
  },
  "initial_state": {
    "reset": {
      "kind": "documented-state",
      "description": "NORMAL DEG blank0 at native1073 followingONC; MODE4 clears stores at1075. Twoidentity1 operands independentlycreateunitmatrices; nohiddenstoreused."
    },
    "setup_sequence": [],
    "mode": {
      "status": "observed",
      "value": "NORMAL"
    },
    "settings": [
      {
        "name": "angle",
        "observation": {
          "status": "observed",
          "value": "DEG"
        }
      },
      {
        "name": "display-format",
        "observation": {
          "status": "observed",
          "value": "NORM1 (pinned reset default)"
        }
      }
    ],
    "display": {
      "upper_line": "",
      "lower_line": "0.",
      "indicators": [
        "DEG"
      ],
      "scroll_arrows": [],
      "cursor": {
        "status": "unknown",
        "reason": "Blink timing not measured; cursor start separately asserted where observed."
      },
      "insert_mode": {
        "status": "unknown",
        "reason": "No timing claim."
      },
      "prompt": null,
      "selected_result_component": null
    },
    "stores": []
  },
  "sequence": [
    "EL506-K04",
    "EL506-K35",
    "EL506-K17",
    "EL506-K42",
    "EL506-K35",
    "EL506-K40",
    "EL506-K39",
    "EL506-K42",
    "EL506-K38",
    "EL506-K40",
    "EL506-K24",
    "EL506-K40",
    "EL506-K42",
    "EL506-K44",
    "EL506-K17",
    "EL506-K42",
    "EL506-K35",
    "EL506-K40",
    "EL506-K38",
    "EL506-K42",
    "EL506-K42",
    "EL506-K42",
    "EL506-K42",
    "EL506-K42",
    "EL506-K42",
    "EL506-K42",
    "EL506-K42",
    "EL506-K42",
    "EL506-K42",
    "EL506-K24",
    "EL506-K42",
    "EL506-K48",
    "EL506-K11",
    "EL506-K11"
  ],
  "frames": [
    {
      "after_step": 0,
      "display": {
        "upper_line": "",
        "lower_line": "0.",
        "indicators": [
          "DEG"
        ],
        "scroll_arrows": [],
        "cursor": {
          "status": "unknown",
          "reason": "Blink timing not measured; cursor start separately asserted where observed."
        },
        "insert_mode": {
          "status": "unknown",
          "reason": "No timing claim."
        },
        "prompt": null,
        "selected_result_component": null
      },
      "result": {
        "status": "observed",
        "value": {
          "encoding": "decimal-string",
          "value": "0",
          "basis": "displayed"
        }
      }
    },
    {
      "after_step": 2,
      "display": {
        "upper_line": "",
        "lower_line": "0.",
        "indicators": [
          "DEG"
        ],
        "scroll_arrows": [],
        "cursor": {
          "status": "unknown",
          "reason": "Blink timing not measured; cursor start separately asserted where observed."
        },
        "insert_mode": {
          "status": "unknown",
          "reason": "No timing claim."
        },
        "prompt": null,
        "selected_result_component": null
      },
      "result": {
        "status": "observed",
        "value": {
          "encoding": "decimal-string",
          "value": "0",
          "basis": "displayed"
        }
      }
    },
    {
      "after_step": 32,
      "display": {
        "upper_line": "ROW=",
        "lower_line": "1.",
        "indicators": [
          "DEG"
        ],
        "scroll_arrows": [],
        "cursor": {
          "status": "unknown",
          "reason": "Blink timing not measured; cursor start separately asserted where observed."
        },
        "insert_mode": {
          "status": "unknown",
          "reason": "No timing claim."
        },
        "prompt": null,
        "selected_result_component": null
      },
      "result": {
        "status": "observed",
        "value": {
          "encoding": "decimal-string",
          "value": "1",
          "basis": "displayed"
        }
      }
    },
    {
      "after_step": 33,
      "display": {
        "upper_line": "COLUMN=",
        "lower_line": "1.",
        "indicators": [
          "DEG"
        ],
        "scroll_arrows": [],
        "cursor": {
          "status": "unknown",
          "reason": "Blink timing not measured; cursor start separately asserted where observed."
        },
        "insert_mode": {
          "status": "unknown",
          "reason": "No timing claim."
        },
        "prompt": null,
        "selected_result_component": null
      },
      "result": {
        "status": "observed",
        "value": {
          "encoding": "decimal-string",
          "value": "1",
          "basis": "displayed"
        }
      }
    },
    {
      "after_step": 34,
      "display": {
        "upper_line": "MAT1,1=",
        "lower_line": "333.3",
        "indicators": [
          "DEG"
        ],
        "scroll_arrows": [],
        "cursor": {
          "status": "unknown",
          "reason": "Blink timing not measured; cursor start separately asserted where observed."
        },
        "insert_mode": {
          "status": "unknown",
          "reason": "No timing claim."
        },
        "prompt": null,
        "selected_result_component": null
      },
      "result": {
        "status": "observed",
        "value": {
          "encoding": "decimal-string",
          "value": "333.3",
          "basis": "displayed"
        }
      }
    }
  ],
  "stored_values": {
    "coverage": "Visible results only; hidden precision is unmeasured.",
    "observations": []
  },
  "errors": [],
  "sources": [
    {
      "source_id": "live-session",
      "kind": "simulator",
      "reference": "simulator-profile.json",
      "page": null,
      "scope": "Native1074..1107: identity1\u00f73\u00d71E13\u2212identity1\u00d73333333333E3= andvisiblecell333.3. Independentnativeoutput only; hiddenprecision notasserted."
    }
  ],
  "oracle": {
    "selected_source_id": "live-session",
    "simulator_exception_ids": [],
    "disagreements": []
  },
  "ambiguities": [],
  "notes": [
    "One native action and inspected screenshot per step. Only DEG consistently transcribed.",
    "This trace measuresmatrix-by-scalar products anddivision, notmatrix-by-matrix products or elimination."
  ]
}
