{
  "schema_version": 1,
  "experiment_id": "el506-359-matrix-determinant-scalar-type-native-v1",
  "roadmap_item": "EL506-359",
  "catalog_id": "el506-physical-keys-v1",
  "simulator": {
    "profile_id": "sharp-el506ts-pc-simulator-1.0.2.0",
    "product": "SHARP PC Simulator for EL-506TS",
    "build": "1.0.2.0",
    "runtime_sha256": "6bfef4d04900b472892be2d4c54dcfa6013f87232097e32df508ca4c27425530",
    "locale": "English UI; en-US",
    "operating_system": "Windows 11"
  },
  "capture": {
    "date": "2026-10-08",
    "timezone": "America/Port_of_Spain",
    "method": "Live @oai/sky, exactly one native input then an inspected screenshot per action. Independently transcribed significant LCD checkpoints. Only DEG indicator consistently transcribed; other indicators and hidden stored precision are not claimed by this trace. Intermediate golden frames characterize implementation, not independent parity.",
    "evidence_kind": "live-simulator",
    "source_ids": [
      "live-session"
    ]
  },
  "initial_state": {
    "reset": {
      "kind": "documented-state",
      "description": "MAT DEG after independently observed native1108ONC; previous333.3 edit buffer retained but unused by scalar determinant."
    },
    "setup_sequence": [],
    "mode": {
      "status": "observed",
      "value": "MAT"
    },
    "settings": [
      {
        "name": "angle",
        "observation": {
          "status": "observed",
          "value": "DEG"
        }
      },
      {
        "name": "display-format",
        "observation": {
          "status": "observed",
          "value": "NORM1 (pinned reset default)"
        }
      }
    ],
    "display": {
      "upper_line": "",
      "lower_line": "0.",
      "indicators": [
        "DEG",
        "MAT"
      ],
      "scroll_arrows": [],
      "cursor": {
        "status": "unknown",
        "reason": "Blink timing not measured; cursor start separately asserted where observed."
      },
      "insert_mode": {
        "status": "unknown",
        "reason": "No timing claim."
      },
      "prompt": null,
      "selected_result_component": null
    },
    "stores": []
  },
  "sequence": [
    "EL506-K17",
    "EL506-K35",
    "EL506-K45",
    "EL506-K40",
    "EL506-K48"
  ],
  "frames": [
    {
      "after_step": 0,
      "display": {
        "upper_line": "",
        "lower_line": "0.",
        "indicators": [
          "DEG",
          "MAT"
        ],
        "scroll_arrows": [],
        "cursor": {
          "status": "unknown",
          "reason": "Blink timing not measured; cursor start separately asserted where observed."
        },
        "insert_mode": {
          "status": "unknown",
          "reason": "No timing claim."
        },
        "prompt": null,
        "selected_result_component": null
      },
      "result": {
        "status": "not-applicable",
        "reason": "Menu, entry or type error; no computed scalar result"
      }
    },
    {
      "after_step": 1,
      "display": {
        "upper_line": "MAT CHK STO",
        "lower_line": "0. 1 2",
        "indicators": [
          "DEG",
          "MAT"
        ],
        "scroll_arrows": [],
        "cursor": {
          "status": "unknown",
          "reason": "Blink timing not measured; cursor start separately asserted where observed."
        },
        "insert_mode": {
          "status": "unknown",
          "reason": "No timing claim."
        },
        "prompt": null,
        "selected_result_component": null
      },
      "result": {
        "status": "not-applicable",
        "reason": "Menu, entry or type error; no computed scalar result"
      }
    },
    {
      "after_step": 2,
      "display": {
        "upper_line": "det trans",
        "lower_line": "0. 1",
        "indicators": [
          "DEG",
          "MAT"
        ],
        "scroll_arrows": [],
        "cursor": {
          "status": "unknown",
          "reason": "Blink timing not measured; cursor start separately asserted where observed."
        },
        "insert_mode": {
          "status": "unknown",
          "reason": "No timing claim."
        },
        "prompt": null,
        "selected_result_component": null
      },
      "result": {
        "status": "not-applicable",
        "reason": "Menu, entry or type error; no computed scalar result"
      }
    },
    {
      "after_step": 3,
      "display": {
        "upper_line": "det",
        "lower_line": "0.",
        "indicators": [
          "DEG",
          "MAT"
        ],
        "scroll_arrows": [],
        "cursor": {
          "status": "unknown",
          "reason": "Blink timing not measured; cursor start separately asserted where observed."
        },
        "insert_mode": {
          "status": "unknown",
          "reason": "No timing claim."
        },
        "prompt": null,
        "selected_result_component": null
      },
      "result": {
        "status": "not-applicable",
        "reason": "Menu, entry or type error; no computed scalar result"
      }
    },
    {
      "after_step": 4,
      "display": {
        "upper_line": "det",
        "lower_line": "1.",
        "indicators": [
          "DEG",
          "MAT"
        ],
        "scroll_arrows": [],
        "cursor": {
          "status": "unknown",
          "reason": "Blink timing not measured; cursor start separately asserted where observed."
        },
        "insert_mode": {
          "status": "unknown",
          "reason": "No timing claim."
        },
        "prompt": null,
        "selected_result_component": null
      },
      "result": {
        "status": "not-applicable",
        "reason": "Menu, entry or type error; no computed scalar result"
      }
    },
    {
      "after_step": 5,
      "display": {
        "upper_line": "Error 1",
        "lower_line": "",
        "indicators": [
          "DEG",
          "MAT"
        ],
        "scroll_arrows": [],
        "cursor": {
          "status": "unknown",
          "reason": "Blink timing not measured; cursor start separately asserted where observed."
        },
        "insert_mode": {
          "status": "unknown",
          "reason": "No timing claim."
        },
        "prompt": null,
        "selected_result_component": null
      },
      "result": {
        "status": "not-applicable",
        "reason": "Menu, entry or type error; no computed scalar result"
      }
    }
  ],
  "stored_values": {
    "coverage": "Visible results only; hidden precision is unmeasured.",
    "observations": []
  },
  "errors": [],
  "sources": [
    {
      "source_id": "live-session",
      "kind": "simulator",
      "reference": "simulator-profile.json",
      "page": null,
      "scope": "Native1108..1113: ONC, MATH4, det0, scalar1, ENT gives Error1. Previous matrix result buffer is unused."
    }
  ],
  "oracle": {
    "selected_source_id": "live-session",
    "simulator_exception_ids": [],
    "disagreements": []
  },
  "ambiguities": [],
  "notes": [
    "Six independently inspected native actions; scalar determinant reports Error1.",
    "Blink timing and hidden buffer values are not independently asserted."
  ]
}
