{
  "schema_version": 1,
  "experiment_id": "el506-354-list-empty-exponent-native-v1",
  "roadmap_item": "EL506-354",
  "catalog_id": "el506-physical-keys-v1",
  "simulator": {
    "profile_id": "sharp-el506ts-pc-simulator-1.0.2.0",
    "product": "SHARP PC Simulator for EL-506TS",
    "build": "1.0.2.0",
    "runtime_sha256": "6bfef4d04900b472892be2d4c54dcfa6013f87232097e32df508ca4c27425530",
    "locale": "English UI; en-US",
    "operating_system": "Windows 11"
  },
  "capture": {
    "date": "2026-10-08",
    "timezone": "America/Port_of_Spain",
    "method": "Live @oai/sky, exactly one native input then an inspected screenshot per action. Independently transcribed significant LCD checkpoints. Only DEG indicator consistently transcribed; other indicators and hidden stored precision are not claimed by this trace. Intermediate golden frames characterize implementation, not independent parity.",
    "evidence_kind": "live-simulator",
    "source_ids": [
      "live-session"
    ]
  },
  "initial_state": {
    "reset": {
      "kind": "documented-state",
      "description": "Native1244: LIST1=1.x10^-13 before sequence."
    },
    "setup_sequence": [],
    "mode": {
      "status": "observed",
      "value": "LIST"
    },
    "settings": [
      {
        "name": "angle",
        "observation": {
          "status": "observed",
          "value": "DEG"
        }
      },
      {
        "name": "display-format",
        "observation": {
          "status": "observed",
          "value": "NORM1 (pinned reset default)"
        }
      }
    ],
    "display": {
      "upper_line": "LIST1=",
      "lower_line": "1.x10^-13",
      "indicators": [
        "DEG",
        "LIST"
      ],
      "scroll_arrows": [],
      "cursor": {
        "status": "unknown",
        "reason": "Blink timing not measured; cursor start separately asserted where observed."
      },
      "insert_mode": {
        "status": "unknown",
        "reason": "No timing claim."
      },
      "prompt": null,
      "selected_result_component": null
    },
    "stores": []
  },
  "sequence": [
    "EL506-K40",
    "EL506-K24",
    "EL506-K24",
    "EL506-K47",
    "EL506-K29"
  ],
  "frames": [
    {
      "after_step": 0,
      "display": {
        "upper_line": "LIST1=",
        "lower_line": "1.x10^-13",
        "indicators": [
          "DEG",
          "LIST"
        ],
        "scroll_arrows": [],
        "cursor": {
          "status": "unknown",
          "reason": "Blink timing not measured; cursor start separately asserted where observed."
        },
        "insert_mode": {
          "status": "unknown",
          "reason": "No timing claim."
        },
        "prompt": null,
        "selected_result_component": null
      },
      "result": {
        "status": "observed",
        "value": {
          "encoding": "decimal-string",
          "value": "1E-13",
          "basis": "displayed"
        }
      }
    },
    {
      "after_step": 3,
      "display": {
        "upper_line": "",
        "lower_line": "1.x10^00",
        "indicators": [
          "DEG",
          "LIST"
        ],
        "scroll_arrows": [],
        "cursor": {
          "status": "unknown",
          "reason": "Blink timing not measured; cursor start separately asserted where observed."
        },
        "insert_mode": {
          "status": "unknown",
          "reason": "No timing claim."
        },
        "prompt": null,
        "selected_result_component": null
      },
      "result": {
        "status": "observed",
        "value": {
          "encoding": "decimal-string",
          "value": "1",
          "basis": "displayed"
        }
      }
    },
    {
      "after_step": 4,
      "display": {
        "upper_line": "",
        "lower_line": "1.x10^-00",
        "indicators": [
          "DEG",
          "LIST"
        ],
        "scroll_arrows": [],
        "cursor": {
          "status": "unknown",
          "reason": "Blink timing not measured; cursor start separately asserted where observed."
        },
        "insert_mode": {
          "status": "unknown",
          "reason": "No timing claim."
        },
        "prompt": null,
        "selected_result_component": null
      },
      "result": {
        "status": "observed",
        "value": {
          "encoding": "decimal-string",
          "value": "1",
          "basis": "displayed"
        }
      }
    },
    {
      "after_step": 5,
      "display": {
        "upper_line": "LIST1=",
        "lower_line": "1.",
        "indicators": [
          "DEG",
          "LIST"
        ],
        "scroll_arrows": [],
        "cursor": {
          "status": "unknown",
          "reason": "Blink timing not measured; cursor start separately asserted where observed."
        },
        "insert_mode": {
          "status": "unknown",
          "reason": "No timing claim."
        },
        "prompt": null,
        "selected_result_component": null
      },
      "result": {
        "status": "observed",
        "value": {
          "encoding": "decimal-string",
          "value": "1",
          "basis": "displayed"
        }
      }
    }
  ],
  "stored_values": {
    "coverage": "Visible results only; hidden precision is unmeasured.",
    "observations": []
  },
  "errors": [],
  "sources": [
    {
      "source_id": "live-session",
      "kind": "simulator",
      "reference": "simulator-profile.json",
      "page": null,
      "scope": "Native1245..1249: repeatedExpignored; blanknegativeexponent DAT stores1 inLIST."
    }
  ],
  "oracle": {
    "selected_source_id": "live-session",
    "simulator_exception_ids": [],
    "disagreements": []
  },
  "ambiguities": [],
  "notes": [
    "Each native action followed by inspected screenshot.",
    "Repeated and empty exponent behavior only."
  ]
}
