{
  "schema_version": 1,
  "experiment_id": "el506-350-unavailable-formula-error5-native-v1",
  "roadmap_item": "EL506-350",
  "catalog_id": "el506-physical-keys-v1",
  "simulator": {
    "profile_id": "sharp-el506ts-pc-simulator-1.0.2.0",
    "product": "SHARP PC Simulator for EL-506TS",
    "build": "1.0.2.0",
    "runtime_sha256": "6bfef4d04900b472892be2d4c54dcfa6013f87232097e32df508ca4c27425530",
    "locale": "English UI; en-US",
    "operating_system": "Windows 11"
  },
  "capture": {
    "date": "2026-10-08",
    "timezone": "America/Port_of_Spain",
    "method": "Live @oai/sky, exactly one native input then an inspected screenshot per action. Independently transcribed significant LCD checkpoints. Only DEG indicator consistently transcribed; other indicators and hidden stored precision are not claimed by this trace. Intermediate golden frames characterize implementation, not independent parity.",
    "evidence_kind": "live-simulator",
    "source_ids": [
      "live-session"
    ]
  },
  "initial_state": {
    "reset": {
      "kind": "documented-state",
      "description": "NORMAL DEG blank 0. independently observed at native step 475 after ON/C; prior ANS and stores are unmeasured. F1 is overwritten by this sequence."
    },
    "setup_sequence": [],
    "mode": {
      "status": "observed",
      "value": "NORMAL (pinned reset default)"
    },
    "settings": [
      {
        "name": "angle",
        "observation": {
          "status": "observed",
          "value": "DEG"
        }
      },
      {
        "name": "display-format",
        "observation": {
          "status": "observed",
          "value": "NORM1 (pinned reset default)"
        }
      }
    ],
    "display": {
      "upper_line": "",
      "lower_line": "0.",
      "indicators": [
        "DEG"
      ],
      "scroll_arrows": [],
      "cursor": {
        "status": "unknown",
        "reason": "Blink timing not measured; cursor start separately asserted where observed."
      },
      "insert_mode": {
        "status": "unknown",
        "reason": "No timing claim."
      },
      "prompt": null,
      "selected_result_component": null
    },
    "stores": []
  },
  "sequence": [
    "EL506-K41",
    "EL506-K28",
    "EL506-K08",
    "EL506-K02",
    "EL506-K03",
    "EL506-K39",
    "EL506-K02",
    "EL506-K27",
    "EL506-K08",
    "EL506-K02"
  ],
  "frames": [
    {
      "after_step": 0,
      "display": {
        "upper_line": "",
        "lower_line": "0.",
        "indicators": [
          "DEG"
        ],
        "scroll_arrows": [],
        "cursor": {
          "status": "unknown",
          "reason": "Blink timing not measured; cursor start separately asserted where observed."
        },
        "insert_mode": {
          "status": "unknown",
          "reason": "No timing claim."
        },
        "prompt": null,
        "selected_result_component": null
      },
      "result": {
        "status": "unknown",
        "reason": "Hidden precision is unmeasured."
      }
    },
    {
      "after_step": 3,
      "display": {
        "upper_line": "2\u2192",
        "lower_line": "F1",
        "indicators": [
          "DEG"
        ],
        "scroll_arrows": [],
        "cursor": {
          "status": "unknown",
          "reason": "Blink timing not measured; cursor start separately asserted where observed."
        },
        "insert_mode": {
          "status": "unknown",
          "reason": "No timing claim."
        },
        "prompt": null,
        "selected_result_component": null
      },
      "result": {
        "status": "unknown",
        "reason": "Hidden precision is unmeasured."
      }
    },
    {
      "after_step": 9,
      "display": {
        "upper_line": "Error 5",
        "lower_line": "",
        "indicators": [
          "DEG"
        ],
        "scroll_arrows": [],
        "cursor": {
          "status": "unknown",
          "reason": "Blink timing not measured; cursor start separately asserted where observed."
        },
        "insert_mode": {
          "status": "unknown",
          "reason": "No timing claim."
        },
        "prompt": null,
        "selected_result_component": null
      },
      "result": {
        "status": "unknown",
        "reason": "Hidden precision is unmeasured."
      }
    },
    {
      "after_step": 10,
      "display": {
        "upper_line": "",
        "lower_line": "0 b",
        "indicators": [
          "DEG"
        ],
        "scroll_arrows": [],
        "cursor": {
          "status": "unknown",
          "reason": "Blink timing not measured; cursor start separately asserted where observed."
        },
        "insert_mode": {
          "status": "unknown",
          "reason": "No timing claim."
        },
        "prompt": null,
        "selected_result_component": null
      },
      "result": {
        "status": "unknown",
        "reason": "Hidden precision is unmeasured."
      }
    }
  ],
  "stored_values": {
    "coverage": "Visible results only; hidden precision is unmeasured.",
    "observations": []
  },
  "errors": [],
  "sources": [
    {
      "source_id": "live-session",
      "kind": "simulator",
      "reference": "simulator-profile.json",
      "page": null,
      "scope": "Decimal formula containing 2 stored in F1; binary-mode recall Error 5; ON/C recovery preserving binary mode."
    }
  ],
  "oracle": {
    "selected_source_id": "live-session",
    "simulator_exception_ids": [],
    "disagreements": []
  },
  "ambiguities": [],
  "notes": [
    "Independent physical native steps 476..485. Each action followed by inspected screenshot. Only significant displays and DEG indicator transcribed; hidden prior ANS and unrelated stored values are unmeasured."
  ]
}
