{
  "schema_version": 1,
  "experiment_id": "el506-354-calculus-power-comparison-native-v1",
  "roadmap_item": "EL506-354",
  "catalog_id": "el506-physical-keys-v1",
  "simulator": {
    "profile_id": "sharp-el506ts-pc-simulator-1.0.2.0",
    "product": "SHARP PC Simulator for EL-506TS",
    "build": "1.0.2.0",
    "runtime_sha256": "6bfef4d04900b472892be2d4c54dcfa6013f87232097e32df508ca4c27425530",
    "locale": "English UI; en-US",
    "operating_system": "Windows 11"
  },
  "capture": {
    "date": "2026-10-08",
    "timezone": "America/Port_of_Spain",
    "method": "Live @oai/sky, exactly one native input then an inspected screenshot per action. Independently transcribed significant LCD checkpoints. Only DEG indicator consistently transcribed; other indicators and hidden stored precision are not claimed by this trace. Intermediate golden frames characterize implementation, not independent parity.",
    "evidence_kind": "live-simulator",
    "source_ids": [
      "live-session"
    ]
  },
  "initial_state": {
    "reset": {
      "kind": "documented-state",
      "description": "NORMAL DEG blank 0. observed at retained native step 591; prior memories and ANS unmeasured and not used."
    },
    "setup_sequence": [],
    "mode": {
      "status": "observed",
      "value": "NORMAL (pinned reset default)"
    },
    "settings": [
      {
        "name": "angle",
        "observation": {
          "status": "observed",
          "value": "DEG"
        }
      },
      {
        "name": "display-format",
        "observation": {
          "status": "observed",
          "value": "NORM1 (pinned reset default)"
        }
      }
    ],
    "display": {
      "upper_line": "",
      "lower_line": "0.",
      "indicators": [
        "DEG"
      ],
      "scroll_arrows": [],
      "cursor": {
        "status": "unknown",
        "reason": "Blink timing not measured; cursor start separately asserted where observed."
      },
      "insert_mode": {
        "status": "unknown",
        "reason": "No timing claim."
      },
      "prompt": null,
      "selected_result_component": null
    },
    "stores": []
  },
  "sequence": [
    "EL506-K03",
    "EL506-K20",
    "EL506-K33",
    "EL506-K40",
    "EL506-K44",
    "EL506-K05",
    "EL506-K27",
    "EL506-K19",
    "EL506-K41",
    "EL506-K34",
    "EL506-K03",
    "EL506-K16",
    "EL506-K47",
    "EL506-K40",
    "EL506-K25",
    "EL506-K41",
    "EL506-K48",
    "EL506-K48"
  ],
  "frames": [
    {
      "after_step": 0,
      "display": {
        "upper_line": "",
        "lower_line": "0.",
        "indicators": [
          "DEG"
        ],
        "scroll_arrows": [],
        "cursor": {
          "status": "unknown",
          "reason": "Blink timing not measured; cursor start separately asserted where observed."
        },
        "insert_mode": {
          "status": "unknown",
          "reason": "No timing claim."
        },
        "prompt": null,
        "selected_result_component": null
      },
      "result": {
        "status": "unknown",
        "reason": "Hidden precision is unmeasured."
      }
    },
    {
      "after_step": 12,
      "display": {
        "upper_line": "X?",
        "lower_line": "0.",
        "indicators": [
          "DEG"
        ],
        "scroll_arrows": [],
        "cursor": {
          "status": "unknown",
          "reason": "Blink timing not measured; cursor start separately asserted where observed."
        },
        "insert_mode": {
          "status": "unknown",
          "reason": "No timing claim."
        },
        "prompt": null,
        "selected_result_component": null
      },
      "result": {
        "status": "unknown",
        "reason": "Hidden precision is unmeasured."
      }
    },
    {
      "after_step": 17,
      "display": {
        "upper_line": "dx?",
        "lower_line": "0.000005",
        "indicators": [
          "DEG"
        ],
        "scroll_arrows": [],
        "cursor": {
          "status": "unknown",
          "reason": "Blink timing not measured; cursor start separately asserted where observed."
        },
        "insert_mode": {
          "status": "unknown",
          "reason": "No timing claim."
        },
        "prompt": null,
        "selected_result_component": null
      },
      "result": {
        "status": "unknown",
        "reason": "Hidden precision is unmeasured."
      }
    },
    {
      "after_step": 18,
      "display": {
        "upper_line": "d/dx=",
        "lower_line": "0.577350268",
        "indicators": [
          "DEG"
        ],
        "scroll_arrows": [],
        "cursor": {
          "status": "unknown",
          "reason": "Blink timing not measured; cursor start separately asserted where observed."
        },
        "insert_mode": {
          "status": "unknown",
          "reason": "No timing claim."
        },
        "prompt": null,
        "selected_result_component": null
      },
      "result": {
        "status": "unknown",
        "reason": "Hidden precision is unmeasured."
      }
    }
  ],
  "stored_values": {
    "coverage": "Visible results only; hidden precision is unmeasured.",
    "observations": []
  },
  "errors": [],
  "sources": [
    {
      "source_id": "live-session",
      "kind": "simulator",
      "reference": "simulator-profile.json",
      "page": null,
      "scope": "General y^x exponent two reproduces the square-shortcut guide derivative at X=-1/2."
    }
  ],
  "oracle": {
    "selected_source_id": "live-session",
    "simulator_exception_ids": [],
    "disagreements": []
  },
  "ambiguities": [],
  "notes": [
    "General y^x exponent two reproduces the square-shortcut guide derivative at X=-1/2.",
    "All physical inputs individually clicked and followed by inspected fresh screenshots. Significant checkpoints independently transcribed. Hidden precision unmeasured."
  ]
}
